{
"claims": [
{"surface":"evaluator","tier":1}
],
"corpus_hash": "sha256:ddc5cf824b06b4899e1bd4166263a1ee07016ff239216e029b9276ac17243975",
"entries": [
{"case_id":"comparison/eq-string-true","surface":"compiler","tier":1},
{"case_id":"comparison/gt-int-boundary","surface":"compiler","tier":1},
{"case_id":"comparison/gt-int-false","surface":"compiler","tier":1},
{"case_id":"comparison/gt-int-true","surface":"compiler","tier":1},
{"case_id":"comparison/gte-int-boundary-true","surface":"compiler","tier":1},
{"case_id":"comparison/eq-string-true","surface":"evaluator","tier":1},
{"case_id":"comparison/gt-int-boundary","surface":"evaluator","tier":1},
{"case_id":"comparison/gt-int-false","surface":"evaluator","tier":1},
{"case_id":"comparison/gt-int-true","surface":"evaluator","tier":1},
{"case_id":"comparison/gte-int-boundary-true","surface":"evaluator","tier":1},
{"case_id":"comparison/loose-eq-cross-type-is-undefined","surface":"evaluator","tier":1},
{"case_id":"comparison/loose-eq-int-float","surface":"evaluator","tier":1},
{"case_id":"comparison/lt-boolean-false-before-true","surface":"evaluator","tier":1},
{"case_id":"comparison/lt-int-true","surface":"evaluator","tier":1},
{"case_id":"comparison/lt-list-elementwise","surface":"evaluator","tier":1},
{"case_id":"comparison/lt-list-prefix","surface":"evaluator","tier":1},
{"case_id":"comparison/lt-string-lexicographic","surface":"evaluator","tier":1},
{"case_id":"comparison/lte-int-false","surface":"evaluator","tier":1},
{"case_id":"comparison/ne-int-true","surface":"evaluator","tier":1},
{"case_id":"comparison/strict-eq-cross-type-is-false-not-undefined","surface":"evaluator","tier":1},
{"case_id":"comparison/strict-eq-int-float-false","surface":"evaluator","tier":1},
{"case_id":"comparison/strict-eq-list-true","surface":"evaluator","tier":1},
{"case_id":"comparison/strict-ne-list-true","surface":"evaluator","tier":1},
{"case_id":"comparison/type-mismatch-is-undefined-not-error","surface":"evaluator","tier":1},
{"case_id":"core/literal-integer","surface":"evaluator","tier":1},
{"case_id":"core/literal-null","surface":"evaluator","tier":1},
{"case_id":"core/literal-null-eq-null-propagates","surface":"evaluator","tier":1},
{"case_id":"core/literal-null-strict-eq-null","surface":"evaluator","tier":1},
{"case_id":"core/literal-null-strict-eq-undefined","surface":"evaluator","tier":1},
{"case_id":"core/literal-true","surface":"evaluator","tier":1},
{"case_id":"core/literal-undefined","surface":"evaluator","tier":1},
{"case_id":"core/null-eq-null-propagates","surface":"evaluator","tier":1},
{"case_id":"core/null-eq-undefined-propagates","surface":"evaluator","tier":1},
{"case_id":"core/null-is-falsy-at-jump","surface":"evaluator","tier":1},
{"case_id":"core/null-rejected-by-not","surface":"evaluator","tier":1},
{"case_id":"core/null-strict-eq-null","surface":"evaluator","tier":1},
{"case_id":"core/null-strict-eq-undefined","surface":"evaluator","tier":1},
{"case_id":"core/undefined-eq-propagates","surface":"evaluator","tier":1},
{"case_id":"core/undefined-strict-eq-undefined","surface":"evaluator","tier":1},
{"case_id":"core/undefined-strict-ne-int","surface":"evaluator","tier":1},
{"case_id":"dates/date-list-level-member-steps-to-next","surface":"evaluator","tier":1},
{"case_id":"dates/datetime-list-level-member-steps-to-next","surface":"evaluator","tier":1},
{"case_id":"dates/gt-date-list-members-by-instant","surface":"evaluator","tier":1},
{"case_id":"dates/gt-date-true","surface":"evaluator","tier":1},
{"case_id":"dates/gte-date-boundary-true","surface":"evaluator","tier":1},
{"case_id":"dates/lt-date-list-members-by-instant","surface":"evaluator","tier":1},
{"case_id":"dates/lt-datetime-list-members-by-instant","surface":"evaluator","tier":1},
{"case_id":"dates/lt-datetime-true","surface":"evaluator","tier":1},
{"case_id":"dates/mixed-date-datetime-loose-eq-coerces-to-midnight-utc","surface":"evaluator","tier":1},
{"case_id":"dates/mixed-date-datetime-lt-true","surface":"evaluator","tier":1},
{"case_id":"dates/mixed-date-datetime-strict-eq-is-false","surface":"evaluator","tier":1},
{"case_id":"dates/ne-date-true","surface":"evaluator","tier":1},
{"case_id":"errors/empty-stack-at-halt","surface":"evaluator","tier":1},
{"case_id":"errors/insufficient-operands-compare","surface":"evaluator","tier":1},
{"case_id":"errors/not-type-mismatch","surface":"evaluator","tier":1},
{"case_id":"errors/unary-bang-type-mismatch","surface":"evaluator","tier":1},
{"case_id":"errors/unary-minus-type-mismatch","surface":"evaluator","tier":1},
{"case_id":"errors/unbound-root-variable","surface":"evaluator","tier":1},
{"case_id":"legacy/and-does-not-short-circuit","surface":"evaluator","tier":1},
{"case_id":"legacy/and-rejects-non-boolean","surface":"evaluator","tier":1},
{"case_id":"legacy/and-true-true","surface":"evaluator","tier":1},
{"case_id":"legacy/or-false-true","surface":"evaluator","tier":1},
{"case_id":"legacy/or-rejects-non-boolean","surface":"evaluator","tier":1},
{"case_id":"library/holds-pending-negation","surface":"evaluator","tier":1},
{"case_id":"library/max-renewals-boundary","surface":"evaluator","tier":1},
{"case_id":"logical/and-short-circuit-false","surface":"evaluator","tier":1},
{"case_id":"logical/not-true","surface":"evaluator","tier":1},
{"case_id":"logical/or-short-circuit-true","surface":"evaluator","tier":1},
{"case_id":"logical/unary-bang","surface":"evaluator","tier":1},
{"case_id":"logical/unary-minus","surface":"evaluator","tier":1},
{"case_id":"short_circuit/and-falls-short-on-falsy-left","surface":"evaluator","tier":1},
{"case_id":"short_circuit/and-worked-example","surface":"evaluator","tier":1},
{"case_id":"short_circuit/jump-condition-must-be-boolean","surface":"evaluator","tier":1},
{"case_id":"short_circuit/or-short-circuits-on-truthy-left","surface":"evaluator","tier":1},
{"case_id":"short_circuit/or-worked-example","surface":"evaluator","tier":1}
],
"implementation": "predicator-example",
"isa_version": 6
}
